{
  "schema": 1,
  "engine": 1,
  "status": "planned",
  "operation": "paint-plan",
  "request_hash": "sha256:3333333333333333333333333333333333333333333333333333333333333333",
  "plan_hash": "sha256:4444444444444444444444444444444444444444444444444444444444444444",
  "compiled_hash": "sha256:5555555555555555555555555555555555555555555555555555555555555555",
  "revision_before": "sha256:6666666666666666666666666666666666666666666666666666666666666666",
  "changed_bounds": [10, 20, 80, 20],
  "estimates": {"passes": 1, "strokes": 1, "samples": 129, "dabs": 48, "tiles": 1, "changed_pixels": 2048},
  "dependencies": [],
  "warnings": [],
  "commit": {
    "if_revision": "sha256:6666666666666666666666666666666666666666666666666666666666666666",
    "plan_hash": "sha256:4444444444444444444444444444444444444444444444444444444444444444"
  }
}
